{
  "name": "olivier-vault",
  "owner": {
    "name": "Olivier Morel",
    "email": "olivier@devbox.ch"
  },
  "metadata": {
    "description": "Olivier's personal Claude Code plugin marketplace, with Codex support in Grumpy, Humanizer, and Ponytail."
  },
  "plugins": [
    {
      "name": "update-manager",
      "source": "./plugins/update-manager",
      "description": "Ecosystem-aware dependency update orchestrator for Rust, Python, and Node.",
      "author": {
        "name": "Olivier Morel",
        "email": "olivier@devbox.ch"
      },
      "license": "MIT",
      "keywords": ["deps", "maintenance", "automation", "rust", "python", "node"]
    },
    {
      "name": "grumpy-senior-engineer-workflow",
      "source": "./plugins/grumpy-senior-engineer-workflow",
      "description": "Shared Claude Code and Codex workflow skills for compact project context, approved architecture decision records, ten-section plans, and implementation of approved plans. Claude uses prompt-based planning gates; Codex uses a reminder and local structural checks. User approval remains required.",
      "author": {
        "name": "Olivier Morel",
        "email": "olivier@devbox.ch"
      },
      "keywords": [
        "context",
        "workflow",
        "monorepo",
        "ai-agents",
        "grumpy-senior-engineer",
        "adr",
        "architecture-decision-records",
        "decisions",
        "planning",
        "plan-mode",
        "implementation"
      ]
    },
    {
      "name": "humanizer",
      "source": "./plugins/humanizer",
      "description": "Edit writing to sound more natural using 25 patterns and a draft, audit, and final rewrite. Shared skill for Claude Code and Codex, with standalone reuse in other assistants.",
      "keywords": ["writing", "editing", "humanizer", "prose"]
    },
    {
      "name": "ponytail",
      "source": "./plugins/ponytail",
      "description": "Simplicity-focused coding, review, audit, debt, and help with conversation-specific modes for Claude Code and Codex. Olivier Morel's adaptation of Dietrich Gebert's Ponytail.",
      "author": { "name": "Dietrich Gebert (DietrichGebert)", "url": "https://github.com/DietrichGebert" },
      "license": "MIT",
      "keywords": ["ponytail", "simplicity", "code-review", "technical-debt"]
    }
  ]
}
